[
  {
    "id": "extreme-truth-wild-1",
    "type": "truth",
    "text": "What's your go-to gaming when you're relaxed?",
    "category": "extreme",
    "subOptions": [
      "wild"
    ],
    "intensity": "soft",
    "ageRestricted": true,
    "requiresOptIn": false
  },
  {
    "id": "extreme-truth-wild-2",
    "type": "truth",
    "text": "What's your biggest phobia related to childhood?",
    "category": "extreme",
    "subOptions": [
      "wild"
    ],
    "intensity": "medium",
    "ageRestricted": true,
    "requiresOptIn": false
  },
  {
    "id": "extreme-truth-wild-3",
    "type": "truth",
    "text": "What's your biggest nervousness related to school days?",
    "category": "extreme",
    "subOptions": [
      "wild"
    ],
    "intensity": "medium",
    "ageRestricted": true,
    "requiresOptIn": false
  },
  {
    "id": "extreme-truth-wild-4",
    "type": "truth",
    "text": "What's the biggest misjudgment you've made in a personal matter?",
    "category": "extreme",
    "subOptions": [
      "wild"
    ],
    "intensity": "medium",
    "ageRestricted": true,
    "requiresOptIn": false
  },
  {
    "id": "extreme-truth-wild-5",
    "type": "truth",
    "text": "What's the biggest wrong decision you've made in a friendship?",
    "category": "extreme",
    "subOptions": [
      "wild"
    ],
    "intensity": "medium",
    "ageRestricted": true,
    "requiresOptIn": false
  },
  {
    "id": "extreme-truth-wild-6",
    "type": "truth",
    "text": "What's your biggest phobia related to fears?",
    "category": "extreme",
    "subOptions": [
      "wild"
    ],
    "intensity": "medium",
    "ageRestricted": true,
    "requiresOptIn": false
  },
  {
    "id": "extreme-truth-wild-7",
    "type": "truth",
    "text": "What's your biggest dread related to personality?",
    "category": "extreme",
    "subOptions": [
      "wild"
    ],
    "intensity": "medium",
    "ageRestricted": true,
    "requiresOptIn": false
  },
  {
    "id": "extreme-truth-wild-8",
    "type": "truth",
    "text": "What's a revelation you've kept from your classmate?",
    "category": "extreme",
    "subOptions": [
      "wild"
    ],
    "intensity": "medium",
    "ageRestricted": true,
    "requiresOptIn": false
  },
  {
    "id": "extreme-truth-wild-9",
    "type": "truth",
    "text": "What's the biggest fault you've made in a family situation?",
    "category": "extreme",
    "subOptions": [
      "wild"
    ],
    "intensity": "medium",
    "ageRestricted": true,
    "requiresOptIn": false
  },
  {
    "id": "extreme-truth-wild-10",
    "type": "truth",
    "text": "What's a confidential information you've kept from your parent?",
    "category": "extreme",
    "subOptions": [
      "wild"
    ],
    "intensity": "medium",
    "ageRestricted": true,
    "requiresOptIn": false
  },
  {
    "id": "extreme-truth-wild-11",
    "type": "truth",
    "text": "What's the most unexpected place you've ever felt chemistry?",
    "category": "extreme",
    "subOptions": [
      "wild"
    ],
    "intensity": "hot",
    "ageRestricted": true,
    "requiresOptIn": false
  },
  {
    "id": "extreme-truth-wild-12",
    "type": "truth",
    "text": "What's the most interesting place you've ever been held?",
    "category": "extreme",
    "subOptions": [
      "wild"
    ],
    "intensity": "hot",
    "ageRestricted": true,
    "requiresOptIn": false
  },
  {
    "id": "extreme-truth-wild-13",
    "type": "truth",
    "text": "What's a smile that you find most attractive on others?",
    "category": "extreme",
    "subOptions": [
      "wild"
    ],
    "intensity": "hot",
    "ageRestricted": true,
    "requiresOptIn": false
  },
  {
    "id": "extreme-truth-wild-14",
    "type": "truth",
    "text": "What's a feather you've always wanted to try using?",
    "category": "extreme",
    "subOptions": [
      "wild"
    ],
    "intensity": "hot",
    "ageRestricted": true,
    "requiresOptIn": false
  },
  {
    "id": "extreme-truth-wild-15",
    "type": "truth",
    "text": "What's the most interesting fantasy you've had?",
    "category": "extreme",
    "subOptions": [
      "wild"
    ],
    "intensity": "hot",
    "ageRestricted": true,
    "requiresOptIn": false
  },
  {
    "id": "extreme-truth-wild-16",
    "type": "truth",
    "text": "What's the most challenging thing someone has done that immediately attracted you to them?",
    "category": "extreme",
    "subOptions": [
      "wild"
    ],
    "intensity": "hot",
    "ageRestricted": true,
    "requiresOptIn": false
  },
  {
    "id": "extreme-truth-wild-17",
    "type": "truth",
    "text": "What's the most embarrassing place you've ever been been close to someone?",
    "category": "extreme",
    "subOptions": [
      "wild"
    ],
    "intensity": "hot",
    "ageRestricted": true,
    "requiresOptIn": false
  },
  {
    "id": "extreme-truth-wild-18",
    "type": "truth",
    "text": "What's the most unexpected place you've ever felt desire?",
    "category": "extreme",
    "subOptions": [
      "wild"
    ],
    "intensity": "hot",
    "ageRestricted": true,
    "requiresOptIn": false
  },
  {
    "id": "extreme-truth-wild-19",
    "type": "truth",
    "text": "What's the most challenging place you've ever been held?",
    "category": "extreme",
    "subOptions": [
      "wild"
    ],
    "intensity": "hot",
    "ageRestricted": true,
    "requiresOptIn": false
  },
  {
    "id": "extreme-truth-wild-20",
    "type": "truth",
    "text": "What's your favorite form of cuddling?",
    "category": "extreme",
    "subOptions": [
      "wild"
    ],
    "intensity": "hot",
    "ageRestricted": true,
    "requiresOptIn": false
  },
  {
    "id": "extreme-truth-wild-21",
    "type": "truth",
    "text": "What's the most exciting place you've ever been held?",
    "category": "extreme",
    "subOptions": [
      "wild"
    ],
    "intensity": "hot",
    "ageRestricted": true,
    "requiresOptIn": false
  },
  {
    "id": "extreme-truth-wild-22",
    "type": "truth",
    "text": "What's something that always puts you in the mood for closeness?",
    "category": "extreme",
    "subOptions": [
      "wild"
    ],
    "intensity": "hot",
    "ageRestricted": true,
    "requiresOptIn": false
  },
  {
    "id": "extreme-truth-wild-23",
    "type": "truth",
    "text": "What's the most funny place you've ever been connected with someone?",
    "category": "extreme",
    "subOptions": [
      "wild"
    ],
    "intensity": "hot",
    "ageRestricted": true,
    "requiresOptIn": false
  },
  {
    "id": "extreme-truth-wild-24",
    "type": "truth",
    "text": "What's something you find challenging that most people might not?",
    "category": "extreme",
    "subOptions": [
      "wild"
    ],
    "intensity": "hot",
    "ageRestricted": true,
    "requiresOptIn": false
  },
  {
    "id": "extreme-truth-wild-25",
    "type": "truth",
    "text": "What's the most unexpected place you've ever felt spark?",
    "category": "extreme",
    "subOptions": [
      "wild"
    ],
    "intensity": "hot",
    "ageRestricted": true,
    "requiresOptIn": false
  },
  {
    "id": "extreme-truth-wild-26",
    "type": "truth",
    "text": "What's your biggest expression?",
    "category": "extreme",
    "subOptions": [
      "wild"
    ],
    "intensity": "hot",
    "ageRestricted": true,
    "requiresOptIn": false
  },
  {
    "id": "extreme-truth-wild-27",
    "type": "truth",
    "text": "What's the most challenging place you've ever been embraced?",
    "category": "extreme",
    "subOptions": [
      "wild"
    ],
    "intensity": "hot",
    "ageRestricted": true,
    "requiresOptIn": false
  },
  {
    "id": "extreme-truth-wild-28",
    "type": "truth",
    "text": "What's a ice cube you've always wanted to try using?",
    "category": "extreme",
    "subOptions": [
      "wild"
    ],
    "intensity": "hot",
    "ageRestricted": true,
    "requiresOptIn": false
  },
  {
    "id": "extreme-truth-wild-29",
    "type": "truth",
    "text": "What's your biggest quality?",
    "category": "extreme",
    "subOptions": [
      "wild"
    ],
    "intensity": "hot",
    "ageRestricted": true,
    "requiresOptIn": false
  },
  {
    "id": "extreme-truth-wild-30",
    "type": "truth",
    "text": "What's something you wish your partner would do more often in intimate conversation?",
    "category": "extreme",
    "subOptions": [
      "wild"
    ],
    "intensity": "hot",
    "ageRestricted": true,
    "requiresOptIn": false
  },
  {
    "id": "extreme-truth-wild-31",
    "type": "truth",
    "text": "What's something you find interesting that most people might not?",
    "category": "extreme",
    "subOptions": [
      "wild"
    ],
    "intensity": "hot",
    "ageRestricted": true,
    "requiresOptIn": false
  },
  {
    "id": "extreme-truth-wild-32",
    "type": "truth",
    "text": "What's the most surprising thing someone has done that immediately attracted you to them?",
    "category": "extreme",
    "subOptions": [
      "wild"
    ],
    "intensity": "hot",
    "ageRestricted": true,
    "requiresOptIn": false
  },
  {
    "id": "extreme-truth-wild-33",
    "type": "truth",
    "text": "What's the most unusual place you've ever been held?",
    "category": "extreme",
    "subOptions": [
      "wild"
    ],
    "intensity": "hot",
    "ageRestricted": true,
    "requiresOptIn": false
  },
  {
    "id": "extreme-truth-wild-34",
    "type": "truth",
    "text": "What's a secret daydream you've never shared with anyone?",
    "category": "extreme",
    "subOptions": [
      "wild"
    ],
    "intensity": "hot",
    "ageRestricted": true,
    "requiresOptIn": false
  },
  {
    "id": "extreme-truth-wild-35",
    "type": "truth",
    "text": "What's the most unexpected fantasy you've had?",
    "category": "extreme",
    "subOptions": [
      "wild"
    ],
    "intensity": "hot",
    "ageRestricted": true,
    "requiresOptIn": false
  },
  {
    "id": "extreme-truth-wild-36",
    "type": "truth",